{
  "page": "p01",
  "image_size": [
    942,
    1075
  ],
  "text_words": [
    {
      "text": "2⁵ × 13 × 37 × 179 × 471077143",
      "position": [
        128,
        167,
        370,
        182
      ],
      "color": "black"
    },
    {
      "text": "23 × 53 × 2711 × 897232321",
      "position": [
        128,
        183,
        305,
        198
      ],
      "color": "black"
    },
    {
      "text": "307 × 1481 × 1087329742917134306161 × 19193689163997857327327",
      "position": [
        128,
        217,
        700,
        234
      ],
      "color": "black"
    },
    {
      "text": "7 × 17780871841855257950191971103144880245068986055043",
      "position": [
        128,
        235,
        605,
        251
      ],
      "color": "black"
    },
    {
      "text": "2 × 11 × 31 × 13859 × 3684096353459218212734876584482931423",
      "position": [
        128,
        270,
        660,
        287
      ],
      "color": "black"
    },
    {
      "text": "25649821274850734656854890069058197080762302797",
      "position": [
        128,
        288,
        480,
        303
      ],
      "color": "black"
    },
    {
      "text": "20824027389475657 × 652791699238832001551",
      "position": [
        128,
        323,
        450,
        340
      ],
      "color": "black"
    },
    {
      "text": "2 × 17 × 1621 × 32297 × 111623 × 91673033412247294680859",
      "position": [
        128,
        341,
        590,
        358
      ],
      "color": "black"
    },
    {
      "text": "5 × 61 × 103 × 113867495484484178331304153088007990084363783",
      "position": [
        128,
        376,
        720,
        394
      ],
      "color": "black"
    },
    {
      "text": "17 × 179 × 3467 × 3219089891 × 264850496551597978818922424250101",
      "position": [
        128,
        394,
        735,
        411
      ],
      "color": "black"
    },
    {
      "text": "7² × 51749 × 163247627693 × 326153706904016588185517",
      "position": [
        128,
        461,
        535,
        478
      ],
      "color": "black"
    },
    {
      "text": "6932277120159617 × 85305751599324144869923657",
      "position": [
        128,
        478,
        525,
        495
      ],
      "color": "black"
    },
    {
      "text": "2 × 3 × 5 × 397 × 6798111767 × 39981184788031",
      "position": [
        128,
        504,
        440,
        521
      ],
      "color": "black"
    },
    {
      "text": "37 × 21503 × 10258109 × 6747307626687311",
      "position": [
        128,
        522,
        430,
        539
      ],
      "color": "black"
    },
    {
      "text": "2² × 3 × 11 × 521 × 1951 × 3373 × 8521 × 184669",
      "position": [
        128,
        548,
        470,
        565
      ],
      "color": "black"
    },
    {
      "text": "7 × 53 × 709 × 3627657401137709",
      "position": [
        128,
        565,
        345,
        582
      ],
      "color": "black"
    },
    {
      "text": "2 × 3³ × 55751765471057",
      "position": [
        128,
        597,
        295,
        613
      ],
      "color": "black"
    },
    {
      "text": "61 × 317 × 443 × 470896109",
      "position": [
        128,
        614,
        305,
        630
      ],
      "color": "black"
    },
    {
      "text": "2 × 3 × 5 × 13 × 157 × 8663 × 68813 × 21019979",
      "position": [
        128,
        690,
        440,
        707
      ],
      "color": "black"
    },
    {
      "text": "23 × 83 × 11949331 × 45067300603",
      "position": [
        128,
        708,
        345,
        724
      ],
      "color": "black"
    },
    {
      "text": "2 × 105557 × 12578337 × 153880609",
      "position": [
        128,
        738,
        360,
        754
      ],
      "color": "black"
    },
    {
      "text": "431 × 563 × 3257 × 167597 × 41337883",
      "position": [
        128,
        755,
        340,
        771
      ],
      "color": "black"
    },
    {
      "text": "2³ × 5 × 7² × 461 × 96681715401559",
      "position": [
        128,
        786,
        365,
        802
      ],
      "color": "black"
    },
    {
      "text": "109 × 1741 × 308405893609031",
      "position": [
        128,
        803,
        320,
        819
      ],
      "color": "black"
    },
    {
      "text": "7196993 × 63653689179445812751",
      "position": [
        128,
        832,
        380,
        848
      ],
      "color": "black"
    },
    {
      "text": "9928974360853 × 11601744609097",
      "position": [
        128,
        849,
        340,
        865
      ],
      "color": "black"
    },
    {
      "text": "2⁵ × 3² × 151 × 929 × 2851 × 71777 × 17179879599815040097271",
      "position": [
        128,
        878,
        625,
        895
      ],
      "color": "black"
    },
    {
      "text": "139 × 10380937 × 239135080477 × 55157555601341549",
      "position": [
        128,
        896,
        545,
        912
      ],
      "color": "black"
    },
    {
      "text": "2663 × 527321834009330157320330830319",
      "position": [
        128,
        926,
        400,
        942
      ],
      "color": "black"
    },
    {
      "text": "2 × 986094191 × 3121883712968346492645571",
      "position": [
        128,
        943,
        440,
        960
      ],
      "color": "black"
    },
    {
      "text": "3 × 4351757 × 21485973838025664080646395598811170316033",
      "position": [
        128,
        974,
        620,
        991
      ],
      "color": "black"
    },
    {
      "text": "2 × 18792640842998671405611426760855001373437954283",
      "position": [
        128,
        992,
        600,
        1008
      ],
      "color": "black"
    }
  ],
  "symbols": [],
  "drawings": [
    {
      "type": "silhouette",
      "position": [
        715,
        145,
        870,
        985
      ],
      "color": "black",
      "description": "Tall, vertical silhouette figure on the right side of the page. It has a rounded/bulbous top resembling a head with two small protrusions (possibly ears or horns), a narrower neck, a torso with slight indentations suggesting arms or wings, and a long flowing body that tapers downward. The figure appears to be a stylized human-like or totemic form, possibly a seal/sigil or anatomical silhouette. The shape includes some detached or loosely connected blob-like elements near the middle and lower portions. The base has small scattered fragments."
    }
  ],
  "digits": [],
  "formulas": [
    {
      "type": "prime_factorization",
      "position": [
        128,
        167,
        735,
        1008
      ],
      "description": "Series of 16 stacked blocks, each containing two lines of prime factorizations of large numbers, separated by a horizontal rule. The upper line in each pair gives the factorization of a number, the lower line appears to give the prime factors of the cofactor or the other way around. These are sequential entries of a factorization list."
    }
  ],
  "mixed_media_regions": [
    {
      "position": [
        115,
        145,
        870,
        1010
      ],
      "description": "The page juxtaposes a left column of dense numerical/mathematical text (prime factorizations) with a right-side black silhouette drawing. The two elements are visually separate but share the same page space, creating a mixed-media composition of text + silhouette."
    }
  ],
  "uncertain": [
    "Whether the silhouette is a known seal, sigil, or specific figure (cannot identify with confidence)",
    "The exact meaning/intent of pairing prime factorizations with the silhouette",
    "Some digits in the longest numbers (e.g., in the 50+ digit factorizations) may be uncertain due to small print and OCR limits"
  ]
}